serial_number,name,year,act_number,section,page_number,source
779,"Sexual Harassment of Women at Work place (Prevention, Prohibition and Red ressal) Act",2013,14,,17,table
780,Shillon g (Rifle Range and Umlong) Cantonments Assimilation of Laws Act,1954,31,,17,table
781,Shore Nuisances (Bombay and Kolaba) Act,1853,11,,17,table
782,Sick In dustrial Companies (Special Provisions) Repeal Act,2004,1,,17,table
783,Sick T extile Undertakings (Nationalisation)Act,1974,57,,17,table
784,Sikh G urdwaras (Supplementary)Act,1925,24,,17,table
785,Sikkim University Act,2007,10,,17,table
786,Sir Din shaw Maneckjee Petit Act,1893,6,,17,table
787,Sir Jam setjee Jejeebhoy Baronetcy Act,1915,10,,17,table
788,Slum A reas (Improvement and Clearance) Act,1956,96,,17,table
789,Small Industries Development Bank of India Act,1989,39,,17,table
790,Smugg lers and Foreign Exchange Manipulators (Forfeiture of Property) Act,1976,13,,17,table
791,Societ ies Registration Act,1860,21,,17,table
792,South Asian University Act,2009,8,,17,table
793,Specia l Court (Trial of Offences Relating to Transactions in Securities) Act,1992,27,,17,table
794,Specia l Criminal Courts (Jurisdiction) Act,1950,18,,17,table
795,Specia l Economic Zones Act,2005,28,,17,table
796,Specia l Marriage Act,1954,43,,17,table
797,Specia l Protection Group Act,1988,34,,17,table
798,Specif ic Relief Act,1963,47,,17,table
799,Specif ied Bank Notes (Cessation of Liabilities) Act,2017,2,,17,table
800,Spices Board Act,1986,10,,17,table
801,Sports Broad casting Signals (Mandatory Sharing with Prasar Bharti) Act,2007,11,,17,table
802,"Sree C hitra Tirunal Institute for Medical Sciences and Technology, Trivandrum Act",1980,52,,17,table
757,Salar J ung Museum Act,1961,26,,17,text
758,"Salary , Allowances and Pension of Members of Parliament Act",1954,30,,17,text
768,Schedu led Tribes and Other Traditional Forest Dwellers (Recognition,2007,2,,17,text
776,Securi tisation and Reconstruction of Financial Assets and Enforcement,2002,54,,17,text
779,"Sexual Harassment of Women at Work place (Prevention, Prohibition",2013,14,,17,text
780,Shillon g (Rifle Range and Umlong) Cantonments Assimilation of,1954,31,,17,text
790,Smugg lers and Foreign Exchange Manipulators (Forfeiture of,1976,13,,17,text
793,Specia l Court (Trial of Offences Relating to Transactions in,1992,27,,17,text
802,"Sree C hitra Tirunal Institute for Medical Sciences and Technology,",1980,52,,17,text
805,State A ssociated Banks (Miscellaneous Provisions) Act,1962,56,,18,table
806,State B ank of India Act,1955,23,,18,table
807,State B ank of Sikkim (Acquisition of Shares) and Miscellaneous Provisions Act,1982,62,,18,table
808,State F inancial Corporations Act,1951,63,,18,table
809,State E mblems of India (Prohibition of Improper Use) Act,2005,50,,18,table
810,State o f Arunachal Pradesh Act,1986,69,,18,table
811,State o f Himachal Pradesh Act,1970,53,,18,table
812,State o f Mizoram Act,1986,34,,18,table
813,State o f Nagaland Act,1962,27,,18,table
814,States Reorganisation Act,1956,37,,18,table
815,Street Vendors (Protection of Livelihood and Regulation of Street Vending) Act,2014,7,,18,table
816,Sugar Development Fund Act,1982,4,,18,table
817,Sugar Export Promotion Act,1958,30,,18,table
818,Suits V aluation Act,1887,7,,18,table
819,Suppr ession of Unlawful Acts against Safety of Civil Aviation Act,1982,66,,18,table
820,Suppr ession of Unlawful Acts against Safety of Maritime Navigation and Fixed Plat forms on Continental Shelf Act,2002,69,,18,table
821,Suprem e Court (Enlargement of Criminal Appellate Jurisdiction) Act,1970,28,,18,table
822,Suprem e Court Judges (Salaries and Conditions of Service) Act,1958,41,,18,table
823,Suprem e Court (Number of Judges) Act,1956,55,,18,table
824,Surrog acy (Regulation) Act,2021,47,,18,table
825,Swade shi Cotton Mills Company Limited (Acquisition and Transfer of Undertakings) Act,1986,30,,18,table
826,Tamil Nadu Legislative Council Act,2010,16,T,18,table
827,Taxati on Laws (Continuation and Validation of Recovery Proceedings) Act,1964,11,,18,table
828,Taxati on Laws (Extension to Jammu and Kashmir) Act,1972,25,,18,table
829,Tea A ct,1953,29,,18,table
830,Techn ology Development Board Act,1995,44,,18,table
831,Teleco m Regulatory Authority of India Act,1997,24,,18,table
832,Teleco mmunication Act,2023,44,,18,table
833,Territo rial Army Act,1948,56,,18,table
834,"Territo rial Waters, Continental Shelf, Exclusive Economic Zone and Other Maritime Zones Act",1976,80,,18,table
835,Terror ist Affected Areas (Special Courts) Act,1984,61,,18,table
836,Textile Undertakings (Nationalisation) Act,1995,39,,18,table
837,Textile s Committee Act,1963,41,,18,table
838,Tezpu r University Act,1993,45,,18,table
839,Tobac co Board Act,1975,4,,18,table
840,Tobac co Duty (Town of Bombay) Act,1857,4,,18,table
841,Tokyo Convention Act,1975,20,,18,table
842,Trade Marks Act,1999,47,,18,table
843,Trade Unions Act,1926,16,,18,table
844,Transf er of Prisoners Act,1950,29,,18,table
845,Transf er of Property Act,1882,4,,18,table
846,Transg ender Persons (Protection of Rights) Act,2019,40,,18,table
847,Transp lantation of Human Organs Act,1994,42,,18,table
848,‘‘Tribh uvan” Sahkari University Act,2025,11,,18,table
849,Tribun als Reforms Act,2021,33,,18,table
850,Tripur a Land Revenue and Land Reforms Act,1960,43,,18,table
803,Stage- Carriages Act,1861,16,,18,text
804,State A rmed Police Forces (Extension of Laws) Act,1952,63,,18,text
807,State B ank of Sikkim (Acquisition of Shares) and Miscellaneous,1982,62,,18,text
815,Street Vendors (Protection of Livelihood and Regulation of Street,2014,7,,18,text
820,Suppr ession of Unlawful Acts against Safety of Maritime Navigation,2002,69,,18,text
825,Swade shi Cotton Mills Company Limited (Acquisition and Transfer of,1986,30,,18,text
827,Taxati on Laws (Continuation and Validation of Recovery,1964,11,,18,text
834,"Territo rial Waters, Continental Shelf, Exclusive Economic Zone and",1976,80,,18,text
853,"Unifie d Waqf Management, Empowerment, Efficiency and Development Act",1995,43,U,19,table
854,Union Duties of Excise (Distribution)Act,1979,24,,19,table
855,Union Territories (Direct Election to the House of the People) Act,1965,49,,19,table
856,Union Territory Goods and Services Tax Act,2017,14,,19,table
857,Union Territories (Laws) Act,1950,30,,19,table
858,Union Territories (Separation of Judicial and Executive Functions) Act,1969,19,,19,table
859,Union Territories (Stamp and Court-fees Laws) Act,1961,33,,19,table
860,Unit T rust of India (Transfer of Undertaking and Repeal) Act,2002,58,,19,table
861,United Nations (Privileges and Immunities) Act,1947,46,,19,table
862,United Nations (Security Council) Act,1947,43,,19,table
863,Univer sity Grants Commission Act,1956,03,,19,table
864,Univer sity of Hyderabad Act,1974,39,,19,table
865,Univer sity of Allahabad Act,2005,26,,19,table
866,Unlaw ful Activities (Prevention)Act,1967,37,,19,table
867,Unorg anised Sector Workers Social Security Act,2008,33,,19,table
868,Urban Land (Ceiling and Regulation) Repeal Act,1999,15,,19,table
869,Usurio us Loans Act,1918,10,,19,table
870,Uttara nchal (Alteration of Name) Act,2006,52,,19,table
871,Uttar P radesh Reorganisation Act,2000,29,,19,table
872,Van (S anrakshan Evam Samvardhan) Adhiniyam,1980,69,V,19,table
873,Vice-President's Pension Act,1997,30,,19,table
874,Victor ia Memorial Act,1903,10,,19,table
875,Visva- Bharati Act,1951,29,,19,table
876,Volun tary Surrender of Salaries (Exemption from Taxation) Act,1961,46,,19,table
877,Wareh ousing Corporations Act,1962,58,,19,table
878,Wareh ousing Corporations (Supplementary) Act,1965,20,,19,table
879,Wareh ousing (Development and Regulation) Act,2007,37,,19,table
880,Waste -Lands (Claims)Act,1863,23,,19,table
881,Water (Prevention and Control of Pollution) Act,1974,6,,19,table
882,Wealth -Tax Act,1957,27,,19,table
883,Weapo ns of Mass Destruction and their Delivery Systems (Prohibition of Unlawful Activities) Act,2005,21,,19,table
884,West G odavari District (Assimilation of Law son Federal Subjects) Act,1949,20,,19,table
885,White Phosphorus Matches Prohibition Act,1913,5,,19,table
886,Wild L ife (Protection) Act,1972,53,,19,table
887,Wome n's and Children's Institutions (Licensing) Act,1956,105,,19,table
888,Worki ng Journalists and Other Newspaper Employees (Conditions of Service) And Miscellaneous Provisions Act,1955,45,,19,table
889,Worki ng Journalists (Fixation of Rates of Wages) Act,1958,29,,19,table
890,Works of Defence Act,1903,7,,19,table
851,Tripur a University Act,2007,9,,19,text
852,Tyre C orporation of India Limited (Disinvestment of Ownership) Act,2007,50,,19,text
853,"Unifie d Waqf Management, Empowerment, Efficiency and",1995,43,,19,text
883,Weapo ns of Mass Destruction and their Delivery Systems (Prohibition,2005,21,,19,text
888,Worki ng Journalists and Other Newspaper Employees (Conditions of,1955,45,,19,text
